zone,n_tickets,lat,lon,junction_name,police_station,address,context,generator_kw
218_183,53,12.994580307538794,77.55425065622482,"BTP011 - RR Kalyana Mantapa, Dr. Rajkumar Road",Rajajinagar,"12th Main Road, Police Quarters, Block 2, Rajaji Nagar, Bengaluru, Karnataka. Pin-560010 (India)",Commercial street,main road
218_184,188,12.994339976348918,77.55470481564609,"BTP011 - RR Kalyana Mantapa, Dr. Rajkumar Road",Rajajinagar,"12th Main Road, Police Quarters, Block 2, Rajaji Nagar, Bengaluru, Karnataka. Pin-560010 (India)",Commercial street,main road
218_196,446,12.99446188295964,77.57147495852018,No Junction,Malleshwaram,"Sri Venkataranga Ayangar Road, Mill Corner Junction, Seshadripuram, Bengaluru, Karnataka. Pin-560020 (India)",Mixed / Other,
218_208,44,12.99403971590909,77.58884392727272,BTP032 - Windsor Circle,High ground,"Palace Road, Embassy Habitat, Abshot Layout, Vasant Nagar, Bengaluru, Karnataka. Pin-560001 (India)",Entertainment,palace
218_209,794,12.99431174256927,77.58936121876575,BTP032 - Windsor Circle,High ground,"Palace Road, Kumar Park, Vasant Nagar, Bengaluru, Karnataka. Pin-560001 (India)",Entertainment,palace
218_223,59,12.994839008474576,77.60948900508475,No Junction,Pulikeshinagar(F.Town),"Promenade Road, Pulikeshi Nagar, Frazer Town, Bengaluru, Karnataka. Pin-560005 (India)",Residential,nagar
218_224,214,12.994504860747664,77.61026580560748,No Junction,Pulikeshinagar(F.Town),"Saunders Road, Pulikeshi Nagar, Frazer Town, Bengaluru, Karnataka. Pin-560005 (India)",Residential,nagar
218_227,56,12.994840035714287,77.61500076785714,No Junction,Pulikeshinagar(F.Town),"Coles Road, Silver Enclave, Frazer Town, Bengaluru, Karnataka. Pin-560005 (India)",Mixed / Other,
218_228,143,12.994490737762238,77.6156786006993,No Junction,Pulikeshinagar(F.Town),"Coles Road, Ranka D Paradise, Frazer Town, Bengaluru, Karnataka. Pin-560005 (India)",Mixed / Other,
218_262,355,12.99403956309859,77.6632269171831,No Junction,Banaswadi,"Old Madras Road, Gopalan Grand Mall, Nagavara Palya, CV Raman Nagar, Bengaluru, Karnataka. Pin-560093 (India)",Mall / Shopping,mall
218_287,75,12.994991520053254,77.69753295246709,No Junction,Mahadevapura,"Whitefield Road, Muthukurappa Colony, Mahadevapura, Bengaluru, Karnataka. Pin-560048 (India)",Residential,colony
218_288,63,12.994653787396148,77.69876177326897,No Junction,Mahadevapura,"Whitefield Road, Munipillapa Layout, Mahadevapura, Bengaluru, Karnataka. Pin-560048 (India)",Residential,layout
219_181,44,12.995689188636364,77.55134724545455,"BTP182 - 19th Main Junction, Rajajinagar",Rajajinagar,"19th Main Road, Rajaji Nagar, Bengaluru, Karnataka. Pin-560010 (India)",Commercial street,main road
219_182,39,12.995150071794873,77.55211724871795,"BTP182 - 19th Main Junction, Rajajinagar",Rajajinagar,"28th Cross Road, Rajaji Nagar, Bengaluru, Karnataka. Pin-560010 (India)",Commercial street,cross
219_190,449,12.996276687305123,77.56317968440979,No Junction,Sheshadripuram,"4th Main Road, Nagappa Block, Srirampuram, Bengaluru, Karnataka. Pin-560021 (India)",Commercial street,main road
219_196,401,12.995723586034911,77.57145898354115,No Junction,Malleshwaram,"Sri Venkataranga Ayangar Road, Shivanandappa Layout, Malleshwaram, Bengaluru, Karnataka. Pin-560003 (India)",Mall / Shopping,mall
219_205,178,12.996286915317766,77.58445629959965,BTP032 - Windsor Circle,Sheshadripuram,"Anna Basavanna Road, RV Layout, Seshadripuram, Bengaluru, Karnataka. Pin-560020 (India)",Commercial street,circle
219_224,66,12.99550146060606,77.61091901212122,No Junction,Pulikeshinagar(F.Town),"Saunders Road, Pulikeshi Nagar, Frazer Town, Bengaluru, Karnataka. Pin-560005 (India)",Residential,nagar
219_225,59,12.996006822033898,77.61147903050846,No Junction,Pulikeshinagar(F.Town),"Saunders Road, Pulikeshi Nagar, Frazer Town, Bengaluru, Karnataka. Pin-560005 (India)",Residential,nagar
219_226,482,12.99582023900415,77.61349378526971,No Junction,Pulikeshinagar(F.Town),"Coles Road, Silver Enclave, Frazer Town, Bengaluru, Karnataka. Pin-560005 (India)",Mixed / Other,
219_227,266,12.995457281578947,77.61407265639097,No Junction,Pulikeshinagar(F.Town),"Coles Road, Silver Enclave, Frazer Town, Bengaluru, Karnataka. Pin-560005 (India)",Mixed / Other,
219_228,44,12.995640554545453,77.6161850659091,No Junction,Pulikeshinagar(F.Town),"Robertson Road, Sindhi Colony, Cox Town, Bengaluru, Karnataka. Pin-560005 (India)",Residential,colony
219_229,82,12.996094279268293,77.61714115365854,No Junction,Pulikeshinagar(F.Town),"Wheeler Road, Sindhi Colony, Cox Town, Bengaluru, Karnataka. Pin-560005 (India)",Residential,colony
219_265,112,12.995572222209564,77.66702184114096,No Junction,Mahadevapura,"Old Madras Road, Royal Heritage, Pai Layout, Mahadevapura, Bengaluru, Karnataka. Pin-560016 (India)",Residential,layout
219_266,1382,12.996151222268276,77.66843172216531,No Junction,Mahadevapura,"MBT Road, Royal Heritage, Pai Layout, Mahadevapura, Bengaluru, Karnataka. Pin-560016 (India)",Residential,layout
219_284,134,12.996179905896055,77.69360563078726,No Junction,Mahadevapura,"Whitefield Road, Police Quarters Singayyanapalya, Dyavasandra Industrial Estate Phase 2, Mahadevapura, Bengaluru, Karnataka. Pin-560048 (India)",Mixed / Other,
219_285,344,12.995845892066725,77.6947477496817,No Junction,Mahadevapura,"Whitefield Road, VR Mall, Dyavasandra Industrial Estate Phase 2, Mahadevapura, Bengaluru, Karnataka. Pin-560048 (India)",Mall / Shopping,mall
219_286,550,12.99532916998239,77.69618995874296,No Junction,Mahadevapura,"Whitefield Road, Phoenix Marketcity, Dyavasandra Industrial Estate Phase 2, Mahadevapura, Bengaluru, Karnataka. Pin-560048 (India)",Wholesale market,market
219_287,168,12.99526073631963,77.69724369110254,No Junction,Mahadevapura,"Whitefield Road, Phoenix Marketcity, Dyavasandra Industrial Estate Phase 2, Mahadevapura, Bengaluru, Karnataka. Pin-560048 (India)",Wholesale market,market
220_176,92,12.997673609782609,77.54438666304348,BTP205 - Modi Hospital Junction,Vijayanagara,"Padmabhushan Dr MC Modi Road, Adarsha Layout, Basaveshwara Nagar, Bengaluru, Karnataka. Pin-560079 (India)",Hospital,hospital
220_177,85,12.997431298713055,77.54548882312206,BTP205 - Modi Hospital Junction,Vijayanagara,"Padmabhushan Dr MC Modi Road, Indiranagar, Rajaji Nagar, Bengaluru, Karnataka. Pin-560010 (India)",Hospital,hospital
220_178,235,12.997421389628485,77.54679306731916,BTP205 - Modi Hospital Junction,Vijayanagara,"Padmabhushan Dr MC Modi Road, Phase 1, Manjunatha Nagar, Rajaji Nagar, Bengaluru, Karnataka. Pin-560010 (India)",Hospital,hospital
220_179,915,12.997470749508196,77.54816648174864,BTP205 - Modi Hospital Junction,Vijayanagara,"Padmabhushan Dr MC Modi Road, Phase 1, Manjunatha Nagar, Rajaji Nagar, Bengaluru, Karnataka. Pin-560010 (India)",Hospital,hospital
220_180,883,12.997561910637755,77.5496356509039,BTP027 - Modi Bridge Junction,Vijayanagara,"Padmabhushan Dr MC Modi Road, Star Circle, Rajaji Nagar, Bengaluru, Karnataka. Pin-560010 (India)",Commercial street,circle
220_181,123,12.997239082870175,77.55080405205607,BTP027 - Modi Bridge Junction,Rajajinagar,"Basava Mantapa Road, Star Circle, Rajaji Nagar, Bengaluru, Karnataka. Pin-560010 (India)",Commercial street,circle
220_187,34,12.997550852941176,77.55951119999999,No Junction,Rajajinagar,"5th Cross Road, Mariappanapalya, Prakash Nagar, Bengaluru, Karnataka. Pin-560021 (India)",Commercial street,cross
220_189,35,12.996676974285714,77.56219535142857,No Junction,Malleshwaram,"5th Cross Road, Nagappa Block, Srirampuram, Bengaluru, Karnataka. Pin-560021 (India)",Commercial street,cross
220_190,64,12.9965241875,77.56312376875,No Junction,Malleshwaram,"5th Cross Road, Nagappa Block, Srirampuram, Bengaluru, Karnataka. Pin-560021 (India)",Commercial street,cross
220_194,206,12.997197313106797,77.56852116747572,No Junction,Malleshwaram,"4th Main Road, Parisara Organic Junction, Malleshwaram, Bengaluru, Karnataka. Pin-560003 (India)",Mall / Shopping,mall
220_195,87,12.996919057471265,77.57042579770115,No Junction,Malleshwaram,"5th Cross Road, Malleshwaram Circle, Malleshwaram, Bengaluru, Karnataka. Pin-560003 (India)",Mall / Shopping,mall
220_196,185,12.997174208108108,77.5713835027027,No Junction,Malleshwaram,"Sri Venkataranga Ayangar Road, Malleshwaram Circle, Malleshwaram, Bengaluru, Karnataka. Pin-560003 (India)",Mall / Shopping,mall
220_204,30,12.997273946666667,77.58301004333333,BTP032 - Windsor Circle,Sheshadripuram,"5th Main Road, RV Layout, Seshadripuram, Bengaluru, Karnataka. Pin-560020 (India)",Commercial street,main road
220_205,145,12.996976313103449,77.58423950137932,BTP032 - Windsor Circle,Sheshadripuram,"Sankey Road, RV Layout, Seshadripuram, Bengaluru, Karnataka. Pin-560020 (India)",Commercial street,circle
220_224,111,12.997342524324324,77.61037444864866,No Junction,Pulikeshinagar(F.Town),"Coles Road, Cleveland Town, Frazer Town, Bengaluru, Karnataka. Pin-560005 (India)",Mixed / Other,
220_225,77,12.996841015584415,77.6115681987013,No Junction,Pulikeshinagar(F.Town),"Coles Road, Pulikeshi Nagar, Frazer Town, Bengaluru, Karnataka. Pin-560005 (India)",Residential,nagar
220_227,136,12.997025608088236,77.61434695147058,No Junction,Pulikeshinagar(F.Town),"Robertson Road, Frazer Town, Bengaluru, Karnataka. Pin-560005 (India)",Mixed / Other,
220_266,152,12.996662864984495,77.66895390659015,No Junction,Banaswadi,"MBT Road, Tin Factory Junction, Dooravani Nagar, Bengaluru, Karnataka. Pin-560016 (India)",Residential,nagar
220_267,272,12.99689284309921,77.66959283162113,No Junction,Banaswadi,"MBT Road, Tin Factory Junction, Dooravani Nagar, Bengaluru, Karnataka. Pin-560016 (India)",Residential,nagar
220_284,46,12.99699350652174,77.6929212826087,No Junction,Mahadevapura,"Whitefield Road, Police Quarters Singayyanapalya, Dyavasandra Industrial Estate Phase 2, Mahadevapura, Bengaluru, Karnataka. Pin-560048 (India)",Mixed / Other,
221_174,409,12.998583674327627,77.54092647823961,"BTP206 - Shankara Mutt Circle, Vijayanagar",Vijayanagara,"Dr Siddaiah Puranik Marg, Bhimajyothi LIC Colony, Basaveshwara Nagar, Bengaluru, Karnataka. Pin-560079 (India)",Commercial street,circle
221_175,199,12.9985428879397,77.54249291407035,"BTP206 - Shankara Mutt Circle, Vijayanagar",Vijayanagara,"Padmabhushan Dr MC Modi Road, Maruthi Layout, Basaveshwara Nagar, Bengaluru, Karnataka. Pin-560079 (India)",Commercial street,circle
221_176,65,12.997965280262308,77.54380242576416,BTP205 - Modi Hospital Junction,Vijayanagara,"Padmabhushan Dr MC Modi Road, Adarsha Layout, Basaveshwara Nagar, Bengaluru, Karnataka. Pin-560079 (India)",Hospital,hospital
221_179,325,12.998928383384616,77.54857582984616,BTP027 - Modi Bridge Junction,Rajajinagar,"3rd Main Road, Star Circle, Rajaji Nagar, Bengaluru, Karnataka. Pin-560010 (India)",Commercial street,main road
221_180,424,12.99886047071404,77.54963889972335,BTP027 - Modi Bridge Junction,Rajajinagar,"WOC Road, Block 1, Rajaji Nagar, Bengaluru, Karnataka. Pin-560010 (India)",Residential,nagar
221_181,336,12.998374643154762,77.55098415565476,"BTP182 - 19th Main Junction, Rajajinagar",Malleshwaram,"19th Main Road, Block 1, Rajaji Nagar, Bengaluru, Karnataka. Pin-560010 (India)",Commercial street,main road
221_182,704,12.998398310653409,77.55263453167613,BTP008 - Navarang Theatre,Malleshwaram,"80 Feet Ring Road, Navarang Circle, Rajaji Nagar, Bengaluru, Karnataka. Pin-560010 (India)",Entertainment,theatre
221_183,418,12.998285750717704,77.55328066507177,BTP008 - Navarang Theatre,Malleshwaram,"5th Cross Road, Navarang Circle, Rajaji Nagar, Bengaluru, Karnataka. Pin-560010 (India)",Entertainment,theatre
221_184,33,12.998604875757575,77.55525047575757,BTP008 - Navarang Theatre,Malleshwaram,"5th Cross Road, Block 2 Stage 2, Rajaji Nagar, Bengaluru, Karnataka. Pin-560010 (India)",Entertainment,theatre
221_186,31,12.9982269,77.55780247419355,"BTP011 - RR Kalyana Mantapa, Dr. Rajkumar Road",Malleshwaram,"5th Cross Road, Mariappanapalya, Prakash Nagar, Bengaluru, Karnataka. Pin-560021 (India)",Commercial street,cross
221_194,383,12.998709516449086,77.5693359767624,No Junction,Malleshwaram,"Siddavanahalli Krishna Sharma Road, Parisara Organic Junction, Malleshwaram, Bengaluru, Karnataka. Pin-560003 (India)",Mall / Shopping,mall
221_195,53,12.99842479056604,77.57035087924528,No Junction,Malleshwaram,"7th Cross Road, Parisara Organic Junction, Malleshwaram, Bengaluru, Karnataka. Pin-560003 (India)",Mall / Shopping,mall
221_196,211,12.998359415165877,77.57133974597157,No Junction,Malleshwaram,"Sri Venkataranga Ayangar Road, RR Palace, Malleshwaram, Bengaluru, Karnataka. Pin-560003 (India)",Mall / Shopping,mall
221_203,130,12.998345972307693,77.58180684307692,No Junction,Sheshadripuram,"J Lingaiah Road, Kempanna Block, Seshadripuram, Bengaluru, Karnataka. Pin-560020 (India)",Residential,block
221_234,62,12.998861556451613,77.6243956,No Junction,Pulikeshinagar(F.Town),"Banaswadi Main Road, Prestige Woodland Park, Maruthi Sevanagar, Bengaluru, Karnataka. Pin-560005 (India)",Commercial street,main road
221_268,40,12.998218392499998,77.67129894749999,No Junction,Banaswadi,"1st Cross Road, Jyothipuram, Mahadevapura, Bengaluru, Karnataka. Pin-560016 (India)",Commercial street,cross
221_280,36,12.99869356111111,77.68825661666666,No Junction,Mahadevapura,"Whitefield Road, Indian Oil Campus, Mahadevapura, Bengaluru, Karnataka. Pin-560016 (India)",Education,campus
221_284,31,12.998265474193548,77.69312025161291,No Junction,Mahadevapura,"4th Cross Road, Singayyanapalya, Mahadevapura, Bengaluru, Karnataka. Pin-560048 (India)",Commercial street,cross
222_136,47,12.999532946808511,77.48871673404255,No Junction,Kamakshipalya,"Andhrahalli Main Road, Soundarya Layout, Andhrahalli, Bengaluru, Karnataka. Pin-560091 (India)",Commercial street,main road
222_174,65,12.99953334923077,77.54114546615385,"BTP206 - Shankara Mutt Circle, Vijayanagar",Vijayanagara,"Padmabhushan Dr MC Modi Road, Shankarmata Circle, Basaveshwara Nagar, Bengaluru, Karnataka. Pin-560086 (India)",Commercial street,circle
222_179,359,12.999242919220054,77.54867948245125,BTP027 - Modi Bridge Junction,Rajajinagar,"10th Cross Road, Block 1, Rajaji Nagar, Bengaluru, Karnataka. Pin-560010 (India)",Commercial street,cross
222_180,2193,12.999695198458218,77.5496225864299,BTP027 - Modi Bridge Junction,Rajajinagar,"10th Cross Road, Block 1, Rajaji Nagar, Bengaluru, Karnataka. Pin-560010 (India)",Commercial street,cross
222_181,539,12.999928136734693,77.55056799016697,"BTP182 - 19th Main Junction, Rajajinagar",Malleshwaram,"19th Main Road, Block 1, Rajaji Nagar, Bengaluru, Karnataka. Pin-560010 (India)",Commercial street,main road
222_182,79,12.999711648101265,77.55261401139241,BTP008 - Navarang Theatre,Malleshwaram,"80 Feet Ring Road, Block K, Rajaji Nagar, Bengaluru, Karnataka. Pin-560010 (India)",Entertainment,theatre
222_194,319,12.99966614890282,77.56933818275863,No Junction,Malleshwaram,"Siddavanahalli Krishna Sharma Road, Malleshwaram, Bengaluru, Karnataka. Pin-560003 (India)",Mall / Shopping,mall
222_195,71,12.99943966056338,77.57021463521127,No Junction,Malleshwaram,"8th Cross Road, Parisara Organic Junction, Malleshwaram, Bengaluru, Karnataka. Pin-560003 (India)",Mall / Shopping,mall
222_196,1092,12.999646212153735,77.57136476310833,No Junction,Malleshwaram,"Sri Venkataranga Ayangar Road, RR Palace, Malleshwaram, Bengaluru, Karnataka. Pin-560003 (India)",Mall / Shopping,mall
222_205,37,12.999370081081082,77.5838374027027,No Junction,Sadashivanagar,"Palace Road, MD Nanjundaswamy Circle, Rajamahal Guttahalli, Bengaluru, Karnataka. Pin-560003 (India)",Entertainment,palace
222_214,46,12.99964425,77.59668109565217,No Junction,R.T. Nagar,"1st Main Road, Jayamahal Extension, Bengaluru, Karnataka. Pin-560046 (India)",Commercial street,main road
222_224,361,12.999943335734073,77.61098021052632,No Junction,Pulikeshinagar(F.Town),"Robertson Road, Sri Ramakrishnappa Circle, Frazer Town, Bengaluru, Karnataka. Pin-560005 (India)",Commercial street,circle
222_225,158,13.000120203797469,77.61119468734177,No Junction,Pulikeshinagar(F.Town),"Netaji Road, Sri Ramakrishnappa Circle, Frazer Town, Bengaluru, Karnataka. Pin-560005 (India)",Commercial street,circle
222_234,43,12.999274997674418,77.62476627674418,No Junction,Pulikeshinagar(F.Town),"Banaswadi Main Road, Prestige Woodland Park, Maruthi Sevanagar, Bengaluru, Karnataka. Pin-560005 (India)",Commercial street,main road
222_235,87,12.999632242528737,77.6251930275862,No Junction,Pulikeshinagar(F.Town),"Banaswadi Main Road, Prestige Woodland Park, Maruthi Sevanagar, Bengaluru, Karnataka. Pin-560005 (India)",Commercial street,main road
222_270,36,12.99962439068572,77.67444293306019,No Junction,Banaswadi,"Outer Ring Road, Dargah Mohalla, Mahadevapura, Bengaluru, Karnataka. Pin-560016 (India)",Religious,dargah
222_271,154,12.999975127405154,77.67543515360283,No Junction,Banaswadi,"Outer Ring Road, Kotturu, Dooravani Nagar, Bengaluru, Karnataka. Pin-560016 (India)",Residential,nagar
222_272,954,13.00020515660263,77.67686761745446,No Junction,Mahadevapura,"Outer Ring Road, Venkatappa Colony, Mahadevapura, Bengaluru, Karnataka. Pin-560016 (India)",Residential,colony
222_273,423,13.00038494365317,77.67773592810983,No Junction,Mahadevapura,"Outer Ring Road, Venkatappa Colony, Mahadevapura, Bengaluru, Karnataka. Pin-560016 (India)",Residential,colony
222_280,42,12.999500082568938,77.68763067783811,No Junction,Mahadevapura,"Whitefield Road, Indian Oil Campus, Mahadevapura, Bengaluru, Karnataka. Pin-560016 (India)",Education,campus
223_180,141,13.000923113475178,77.54970288439716,"BTP026 - 1st Block Junction, Rajajinagar",Malleshwaram,"WOC Road, Block 1, Rajaji Nagar, Bengaluru, Karnataka. Pin-560010 (India)",Residential,nagar
223_181,448,13.001085647321428,77.55042000602678,"BTP026 - 1st Block Junction, Rajajinagar",Malleshwaram,"19th Main Road, Block 1, Rajaji Nagar, Bengaluru, Karnataka. Pin-560010 (India)",Commercial street,main road
223_194,93,13.001035422580644,77.56928735268818,No Junction,Malleshwaram,"Siddavanahalli Krishna Sharma Road, Kadumalleshwara, Malleshwaram, Bengaluru, Karnataka. Pin-560003 (India)",Mall / Shopping,mall
223_196,319,13.001107812225705,77.57133181567397,No Junction,Malleshwaram,"Sri Venkataranga Ayangar Road, Acharya Sri Ramanuja Circle, Malleshwaram, Bengaluru, Karnataka. Pin-560003 (India)",Mall / Shopping,mall
223_213,73,13.001336447945206,77.5952766630137,No Junction,R.T. Nagar,"2nd Main Road, Income Tax and Central Excise Staff Quarters, Jayamahal Extension, Bengaluru, Karnataka. Pin-560046 (India)",Commercial street,main road
223_225,89,13.00096880224719,77.61204602022471,No Junction,Pulikeshinagar(F.Town),"Madhavaraya Mudaliar Road, Puttanna Junction, Frazer Town, Bengaluru, Karnataka. Pin-560005 (India)",Mixed / Other,
223_227,38,13.000655668421052,77.61478071052632,No Junction,Pulikeshinagar(F.Town),"Madhavaraya Mudaliar Road, Nanjappa Block, Frazer Town, Bengaluru, Karnataka. Pin-560005 (India)",Residential,block
223_272,457,13.000753646795374,77.67694401933946,No Junction,Banaswadi,"MBT Road, Kotturu, Dooravani Nagar, Bengaluru, Karnataka. Pin-560016 (India)",Residential,nagar
223_273,50,13.000577248201123,77.67759405997784,No Junction,Mahadevapura,"Outer Ring Road, Venkatappa Colony, Mahadevapura, Bengaluru, Karnataka. Pin-560016 (India)",Residential,colony
224_163,47,13.00259859787234,77.52593137659574,No Junction,Rajajinagar,"Dr Rajkumar Puniya Bhoomi Road, Swatantra Yodhara Nagar, Laggere, Bengaluru, Karnataka. Pin-560058 (India)",Residential,nagar
224_180,278,13.002607011151078,77.55010114460433,"BTP026 - 1st Block Junction, Rajajinagar",Malleshwaram,"19th Main Road, Dr M Munivenkataswamy Circle, Rajaji Nagar, Bengaluru, Karnataka. Pin-560010 (India)",Commercial street,main road
224_181,111,13.00207381171171,77.55031951801803,"BTP026 - 1st Block Junction, Rajajinagar",Malleshwaram,"19th Main Road, Ketamaranahalli, Block 1, Rajaji Nagar, Bengaluru, Karnataka. Pin-560010 (India)",Commercial street,main road
224_183,112,13.002869382142858,77.55337849374999,"BTP001 - 10th Cross, Dr. Rajkumar Road",Malleshwaram,"80 Feet Ring Road, Ketamaranahalli, Block 1, Rajaji Nagar, Bengaluru, Karnataka. Pin-560010 (India)",Commercial street,cross
224_194,88,13.002178464772726,77.56921765454545,No Junction,Malleshwaram,"Siddavanahalli Krishna Sharma Road, Paresh Apartment, Kadumalleshwara, Malleshwaram, Bengaluru, Karnataka. Pin-560003 (India)",Mall / Shopping,mall
224_195,92,13.001909414130434,77.57069397173913,No Junction,Malleshwaram,"11th Cross Road, Acharya Sri Ramanuja Circle, Malleshwaram, Bengaluru, Karnataka. Pin-560003 (India)",Mall / Shopping,mall
224_196,65,13.00222695076923,77.57123710615384,No Junction,Malleshwaram,"Sri Venkataranga Ayangar Road, Acharya Sri Ramanuja Circle, Malleshwaram, Bengaluru, Karnataka. Pin-560003 (India)",Mall / Shopping,mall
224_225,53,13.002257250943396,77.61203375471698,No Junction,Pulikeshinagar(F.Town),"Tannery Road, Puttanna Junction, Frazer Town, Bengaluru, Karnataka. Pin-560005 (India)",Mixed / Other,
224_330,46,13.002463403104333,77.75719447677777,No Junction,Mahadevapura,"Whitefield Main Road, Sri Sathya Sai Gokulam, Sai Colony, Kadugodi, Bengaluru, Karnataka. Pin-560067 (India)",Commercial street,main road
225_180,296,13.003622460472974,77.54992493581081,"BTP026 - 1st Block Junction, Rajajinagar",Malleshwaram,"19th Main Road, Dr M Munivenkataswamy Circle, Rajaji Nagar, Bengaluru, Karnataka. Pin-560010 (India)",Commercial street,main road
225_183,153,13.004191387278299,77.55344222614525,"BTP001 - 10th Cross, Dr. Rajkumar Road",Malleshwaram,"10th Cross Road, Dr Rajkumar Road 10th Cross Junction, Rajaji Nagar, Bengaluru, Karnataka. Pin-560010 (India)",Commercial street,cross
225_194,43,13.003811018604653,77.56918409534883,No Junction,Malleshwaram,"Siddavanahalli Krishna Sharma Road, Paresh Apartment, Kadumalleshwara, Malleshwaram, Bengaluru, Karnataka. Pin-560003 (India)",Mall / Shopping,mall
225_196,107,13.004029970093457,77.57126092990654,No Junction,Malleshwaram,"Sri Venkataranga Ayangar Road, Krishna Apartment, Kadumalleshwara, Malleshwaram, Bengaluru, Karnataka. Pin-560003 (India)",Mall / Shopping,mall
225_262,69,13.003542315942028,77.66277406666667,No Junction,Banaswadi,"2nd Main Road, Kasturi Nagar, Banaswadi, Bengaluru, Karnataka. Pin-560043 (India)",Commercial street,main road
225_306,143,13.003467653846153,77.72350357482517,No Junction,K.R. Pura,"Kodigehalli Main Road, Aryav Greenfields, Kadugodi, KR Puram, Bengaluru, Karnataka. Pin-560067 (India)",Commercial street,main road
225_330,42,13.004063729232454,77.75697464137912,No Junction,Mahadevapura,"Whitefield Main Road, Wynn Gate, Belathur, Bengaluru, Karnataka. Pin-560067 (India)",Commercial street,main road
226_183,43,13.005029772093025,77.55392292093023,"BTP001 - 10th Cross, Dr. Rajkumar Road",Malleshwaram,"80 Feet Ring Road, Dr Rajkumar Road 10th Cross Junction, Rajaji Nagar, Bengaluru, Karnataka. Pin-560010 (India)",Commercial street,cross
226_193,40,13.005378225000001,77.56818957,No Junction,Malleshwaram,"4th Main Road, Malleshwara Extension, Malleshwaram West, Bengaluru, Karnataka. Pin-560055 (India)",Mall / Shopping,mall
226_194,737,13.005523827272727,77.56891973989146,No Junction,Malleshwaram,"15th Cross Road, Malleshwara Extension, Malleshwaram West, Bengaluru, Karnataka. Pin-560055 (India)",Mall / Shopping,mall
226_195,228,13.005434841666666,77.57021829473683,No Junction,Malleshwaram,"15th Cross Road, Malleshwara Extension, Malleshwaram West, Bengaluru, Karnataka. Pin-560055 (India)",Mall / Shopping,mall
226_196,320,13.0055189109375,77.5712101875,No Junction,Malleshwaram,"Sri Venkataranga Ayangar Road, Ranganathapura, Malleshwaram, Bengaluru, Karnataka. Pin-560003 (India)",Mall / Shopping,mall
226_212,57,13.005030103508771,77.59386809122807,No Junction,R.T. Nagar,"VP Deenadayalu Naidu Road, Rajappa Block, JC Nagar, Bengaluru, Karnataka. Pin-560006 (India)",Residential,nagar
226_278,680,13.005388284529985,77.68523384827888,No Junction,K.R. Pura,"MBT Road, SM Layout, Dooravani Nagar, Bengaluru, Karnataka. Pin-560016 (India)",Residential,layout
226_279,185,13.005760802702703,77.68595155135135,No Junction,K.R. Pura,"MBT Road, SM Layout, Dooravani Nagar, Bengaluru, Karnataka. Pin-560016 (India)",Residential,layout
227_163,42,13.006765392857144,77.52647246190476,No Junction,Rajajinagar,"Laggere Main Road, Freedom Fighters Colony, Laggere, Bengaluru, Karnataka. Pin-560058 (India)",Commercial street,main road
227_164,53,13.006604843396227,77.52700516981132,No Junction,Rajajinagar,"Dr Rajkumar Puniya Bhoomi Road, Freedom Fighters Colony, Laggere, Bengaluru, Karnataka. Pin-560058 (India)",Residential,colony
227_179,190,13.006598681485636,77.54855971637897,BTP023 - Mahalaxmi Layout Entrance,Rajajinagar,"WOC Road, Bovipalya, Mahalakshmipuram, Bengaluru, Karnataka. Pin-560086 (India)",Residential,layout
227_196,830,13.00655221253012,77.57118694554217,No Junction,Malleshwaram,"Sri Venkataranga Ayangar Road, Ranganathapura, Malleshwaram, Bengaluru, Karnataka. Pin-560003 (India)",Mall / Shopping,mall
227_201,99,13.006801170707071,77.57883017070706,No Junction,Sadashivanagar,"3rd Main Road, Bashyam Circle, Sadashiva Nagar, Bengaluru, Karnataka. Pin-560080 (India)",Commercial street,main road
227_211,35,13.006632905714286,77.59274097142857,No Junction,R.T. Nagar,"Jayamahal Main Road, Munireddypalya, JC Nagar, Bengaluru, Karnataka. Pin-560006 (India)",Commercial street,main road
227_212,34,13.006146188235293,77.59324688235293,No Junction,R.T. Nagar,"JC Nagar Main Road, Munireddypalya, JC Nagar, Bengaluru, Karnataka. Pin-560006 (India)",Commercial street,main road
227_232,52,13.006996153846153,77.6215167326923,No Junction,Pulikeshinagar(F.Town),"Lingarajapuram Flyover, Old Bagalur Layout, Lingarajapuram, Bengaluru, Karnataka. Pin-560084 (India)",Residential,layout
227_279,316,13.006117770253166,77.68654765443038,No Junction,K.R. Pura,"MBT Road, SM Layout, Dooravani Nagar, Bengaluru, Karnataka. Pin-560016 (India)",Residential,layout
