zone,n_tickets,lat,lon,junction_name,police_station,address,context,generator_kw
199_203,74,12.968715712162162,77.58104581756757,BTP038 - Mysore Bank Junction,Halasuru Gate,"Jama Masjid Main Road, Ballapurpete, Nagartapete, Bengaluru, Karnataka. Pin-560002 (India)",Religious,masjid
199_206,45,12.969049473333333,77.58570831111112,BTP075 - Police Corner,Halasuru Gate,"District Office Road, Cubbonpet, Nagartapete, Bengaluru, Karnataka. Pin-560002 (India)",Residential,nagar
199_218,43,12.968937260465115,77.60198424651163,"BTP099 - Cash Pharmacy, Residency Road",Ashok Nagar,"Field Marshal KM Cariappa Road, Prestige Towers, Richmond Town, Bengaluru, Karnataka. Pin-560025 (India)",Mixed / Other,
199_246,293,12.969251006825939,77.6413706552901,No Junction,Jeevanbheemanagar,"Domlur Inner Ring Road, HAL Stage 2, Indiranagar, Bengaluru, Karnataka. Pin-560008 (India)",Residential,nagar
199_251,79,12.969071069155905,77.64787398730961,No Junction,Jeevanbheemanagar,"Sir CV Raman Hospital Road, Indian Airlines Staff Quarters, Indiranagar, Bengaluru, Karnataka. Pin-560008 (India)",Hospital,hospital
199_252,64,12.96873084275798,77.64917292031073,No Junction,Jeevanbheemanagar,"Jeevan Bhima Nagar Main Road, Indian Airlines Staff Quarters, Indiranagar, Bengaluru, Karnataka. Pin-560008 (India)",Commercial street,main road
199_253,66,12.968414416666667,77.65035245757576,No Junction,Jeevanbheemanagar,"Jeevan Bhima Nagar Main Road, Indian Airlines Staff Quarters, Indiranagar, Bengaluru, Karnataka. Pin-560008 (India)",Commercial street,main road
199_290,49,12.96852591632653,77.7012465,No Junction,HAL Old Airport,"Outer Ring Road, Karthik Nagar, Marathahalli, Bengaluru, Karnataka. Pin-560037 (India)",Residential,nagar
200_171,83,12.970393471642359,77.53707640024096,"BTP022 - Marenahalli Junction, Vijayanagar",Vijayanagara,"17th Cross Road, Police Quarters, Vijaya Nagar, Bengaluru, Karnataka. Pin-560040 (India)",Commercial street,cross
200_177,74,12.969803344594595,77.54593351891893,No Junction,Vijayanagara,"1st Main Road, Telecom Layout, Cholurpalya, Bengaluru, Karnataka. Pin-560023 (India)",Commercial street,main road
200_178,40,12.9704932875,77.54627494,BTP020 - Hosahalli Metro Station,Vijayanagara,"1st Main Road, Telecom Layout, Cholurpalya, Bengaluru, Karnataka. Pin-560023 (India)",Metro / Transit hub,metro
200_198,73,12.970384932876712,77.57476796849315,BTP043 - Upparpet Junction,City Market,"Old Tharagupete Cross Road, Chickpet Circle, Chickpete, Bengaluru, Karnataka. Pin-560053 (India)",Commercial street,circle
200_199,1844,12.969981960394934,77.57575485716585,BTP043 - Upparpet Junction,City Market,"AS Char Main Road, Chickpet Circle, Chickpete, Bengaluru, Karnataka. Pin-560053 (India)",Commercial street,main road
200_221,456,12.970064596625043,77.60667934394222,No Junction,Ashok Nagar,"Brigade Road, St Patricks Complex, Ashok Nagar, Bengaluru, Karnataka. Pin-560025 (India)",Mall / Shopping,complex
200_224,93,12.970168633945429,77.61020374565089,No Junction,Ashok Nagar,"Commissariat Road, Garuda Mall, Ashok Nagar, Bengaluru, Karnataka. Pin-560025 (India)",Mall / Shopping,mall
200_243,81,12.969878372839506,77.63660761358024,No Junction,Jeevanbheemanagar,"12th Main Road, Indiranagar ESI Hospital Junction, Indiranagar, Bengaluru, Karnataka. Pin-560038 (India)",Hospital,hospital
200_244,95,12.969983458947368,77.63808557157894,No Junction,Jeevanbheemanagar,"12th Main Road, Kittur Rani Chennamma Circle, Indiranagar, Bengaluru, Karnataka. Pin-560008 (India)",Commercial street,main road
200_245,126,12.970089336824012,77.63929028488104,No Junction,Jeevanbheemanagar,"12th Main Road, Kittur Rani Chennamma Circle, Indiranagar, Bengaluru, Karnataka. Pin-560008 (India)",Commercial street,main road
200_246,259,12.969978185440075,77.64117719501832,No Junction,Jeevanbheemanagar,"Domlur Inner Ring Road, Sony World Junction, Indiranagar, Bengaluru, Karnataka. Pin-560008 (India)",Residential,nagar
200_247,38,12.970056515789475,77.64201450263158,No Junction,Jeevanbheemanagar,"12th Main Road, HAL Stage 2, Indiranagar, Bengaluru, Karnataka. Pin-560008 (India)",Commercial street,main road
200_248,60,12.970248195,77.643761505,No Junction,Jeevanbheemanagar,"12th Main Road, HAL Stage 2, Indiranagar, Bengaluru, Karnataka. Pin-560008 (India)",Commercial street,main road
200_249,166,12.97038034533382,77.64506899514467,No Junction,Jeevanbheemanagar,"12th Main Road, Old Thippasandra, Indiranagar, Bengaluru, Karnataka. Pin-560008 (India)",Commercial street,main road
200_250,204,12.9703994073141,77.64632313131082,No Junction,Jeevanbheemanagar,"12th Main Road, The Junction, Indiranagar, Bengaluru, Karnataka. Pin-560008 (India)",Commercial street,main road
200_251,195,12.970399032127762,77.64739278162129,No Junction,Jeevanbheemanagar,"Sir CV Raman Hospital Road, The Junction, Indiranagar, Bengaluru, Karnataka. Pin-560008 (India)",Hospital,hospital
200_289,45,12.969807257777777,77.70038940888888,No Junction,HAL Old Airport,"Outer Ring Road, Karthik Nagar, Marathahalli, Bengaluru, Karnataka. Pin-560037 (India)",Residential,nagar
200_298,124,12.970402201311856,77.71246703636426,No Junction,HAL Old Airport,"ITPL Main Road, Kundalhalli, Bengaluru, Karnataka. Pin-560037 (India)",Commercial street,main road
201_150,87,12.971698337931034,77.50766505977012,No Junction,Jnanabharathi,"Kengeri Main Road, Papareddypalya Circle, Nagarbhavi Stage 2, Bengaluru, Karnataka. Pin-560072 (India)",Commercial street,main road
201_171,276,12.971662838466154,77.53731436607808,BTP028 - Vijayanagar Bus Stand Junction,Vijayanagara,"17th Cross Road, MRCR Extension, Vijaya Nagar, Bengaluru, Karnataka. Pin-560040 (India)",Metro / Transit hub,bus stand
201_178,180,12.971421693888889,77.54664824722222,BTP020 - Hosahalli Metro Station,Vijayanagara,"1st Main Road, Ganesha Garden, Cholurpalya, Bengaluru, Karnataka. Pin-560023 (India)",Metro / Transit hub,metro
201_199,178,12.971087507612717,77.57633921606326,BTP043 - Upparpet Junction,City Market,"AS Char Main Road, Telagupet, Bengaluru, Karnataka. Pin-560002 (India)",Commercial street,main road
201_200,172,12.971810878488371,77.5767577238372,BTP044 - Sagar Theatre Junction,City Market,"AS Char Main Road, Balepete, Chickpete, Bengaluru, Karnataka. Pin-560053 (India)",Entertainment,theatre
201_202,43,12.971994693023255,77.5804564372093,BTP038 - Mysore Bank Junction,Upparpet,"Hospital Road, Mysore Bank Circle, Chickpete, Bengaluru, Karnataka. Pin-560009 (India)",Hospital,hospital
201_203,114,12.9720016,77.58084176666667,BTP038 - Mysore Bank Junction,Upparpet,"Avenue Road, Mysore Bank Circle, Chickpete, Bengaluru, Karnataka. Pin-560009 (India)",Commercial street,circle
201_211,37,12.971140456756757,77.59278961351352,BTP063 - Siddalingaiah Circle,Halasuru Gate,"Kasturba Road, Siddalingaiah Circle, Gandhi Nagar, Bengaluru, Karnataka. Pin-560001 (India)",Commercial street,circle
201_212,55,12.971619549090908,77.59378383272727,BTP063 - Siddalingaiah Circle,Cubbon Park,"Kasturba Road, Siddalingaiah Circle, Gandhi Nagar, Bengaluru, Karnataka. Pin-560001 (India)",Commercial street,circle
201_213,46,12.971606152173914,77.59527063478261,BTP063 - Siddalingaiah Circle,Cubbon Park,"Grant Road, UB City, Shanthala Nagar, Bengaluru, Karnataka. Pin-560001 (India)",Commercial street,circle
201_214,200,12.971198913999999,77.5967481145,BTP063 - Siddalingaiah Circle,Cubbon Park,"Grant Road, UB City, Shanthala Nagar, Bengaluru, Karnataka. Pin-560001 (India)",Commercial street,circle
201_215,675,12.971407937037037,77.59778603688889,BTP063 - Siddalingaiah Circle,Cubbon Park,"Walton Road, Walton Road Circle, Shanthala Nagar, Bengaluru, Karnataka. Pin-560001 (India)",Commercial street,circle
201_220,37,12.971105737837837,77.60530232972974,No Junction,Ashok Nagar,"Field Marshal KM Cariappa Road, Professor Asirvadam Circle, Richmond Town, Bengaluru, Karnataka. Pin-560025 (India)",Commercial street,circle
201_221,107,12.971406580373833,77.60637468411214,No Junction,Ashok Nagar,"Field Marshal KM Cariappa Road, St Patricks Complex, Ashok Nagar, Bengaluru, Karnataka. Pin-560025 (India)",Mall / Shopping,complex
201_222,70,12.971687594252577,77.607330337,No Junction,Ashok Nagar,"Field Marshal KM Cariappa Road, Brigade Road Junction, Ashok Nagar, Bengaluru, Karnataka. Pin-560025 (India)",Commercial street,road junction
201_227,31,12.971392070967742,77.6150123419355,No Junction,Halasur,"Ashley Road, Prestige Falcon Towers, Ashok Nagar, Bengaluru, Karnataka. Pin-560025 (India)",Residential,nagar
201_230,344,12.971421884302327,77.61823785552325,No Junction,Halasur,"Midford Garden Lane, Craig Park Layout, Ashok Nagar, Bengaluru, Karnataka. Pin-560001 (India)",Residential,layout
201_235,42,12.97207816904762,77.62565327142858,No Junction,Halasur,"1st Cross Road, Ranka Court, Halasuru, Bengaluru, Karnataka. Pin-560008 (India)",Commercial street,cross
201_238,34,12.971562426470587,77.6299857,No Junction,Halasur,"Nandanavana G Street, Doddaiah Layout, Halasuru, Bengaluru, Karnataka. Pin-560008 (India)",Commercial street,street
201_251,217,12.971149788684475,77.6473549607301,No Junction,Jeevanbheemanagar,"Sir CV Raman Hospital Road, The Junction, Indiranagar, Bengaluru, Karnataka. Pin-560008 (India)",Hospital,hospital
201_258,628,12.971740339441151,77.6580333624578,No Junction,Jeevanbheemanagar,"Pusa Thippasandra Main Road, Nada Prabhu Kempegowda Circle, New Thippasandra, Bengaluru, Karnataka. Pin-560075 (India)",Commercial street,main road
201_259,563,12.971693355950267,77.658185742984,No Junction,Jeevanbheemanagar,"Pusa Thippasandra Main Road, Nada Prabhu Kempegowda Circle, New Thippasandra, Bengaluru, Karnataka. Pin-560075 (India)",Commercial street,main road
201_297,240,12.971880926783912,77.71171732202912,No Junction,HAL Old Airport,"ITPL Main Road, SJR Brooklyn Apartment, Kundalhalli, Bengaluru, Karnataka. Pin-560037 (India)",Commercial street,main road
201_298,230,12.971248909851235,77.71218332356523,No Junction,HAL Old Airport,"ITPL Main Road, SJR Brooklyn Apartment, Kundalhalli, Bengaluru, Karnataka. Pin-560037 (India)",Commercial street,main road
202_171,140,12.972562298571429,77.53766025142858,BTP028 - Vijayanagar Bus Stand Junction,Vijayanagara,"17th Cross Road, MRCR Extension, Vijaya Nagar, Bengaluru, Karnataka. Pin-560040 (India)",Metro / Transit hub,bus stand
202_172,266,12.972904199812385,77.53822824258464,BTP028 - Vijayanagar Bus Stand Junction,Vijayanagara,"17th Cross Road, Vijaya Nagar, Bengaluru, Karnataka. Pin-560040 (India)",Metro / Transit hub,bus stand
202_173,32,12.973439673557092,77.53965259256529,BTP028 - Vijayanagar Bus Stand Junction,Vijayanagara,"7th Main Road, CPWD Complex, MRCR Layout, Vijaya Nagar, Bengaluru, Karnataka. Pin-560040 (India)",Metro / Transit hub,bus stand
202_178,86,12.972586437209303,77.54724531046512,BTP069 - MC Circle,Magadi Road,"Pipe Line Road, Manuvana, Vijaya Nagar, Bengaluru, Karnataka. Pin-560040 (India)",Commercial street,circle
202_180,122,12.973385168032788,77.54998796311476,"BTP070 - Cholurpalya Junction, Magadi Road",Magadi Road,"1st Cross Road, Vidyaranya Nagar, Cholurpalya, Bengaluru, Karnataka. Pin-560023 (India)",Education,vidya
202_181,1329,12.973432191798345,77.55101388081263,"BTP070 - Cholurpalya Junction, Magadi Road",Magadi Road,"1st Cross Road, Mallige Thotta, Cholurpalya, Bengaluru, Karnataka. Pin-560023 (India)",Mall / Shopping,mall
202_200,444,12.973059905730961,77.57743345229285,BTP044 - Sagar Theatre Junction,City Market,"Hospital Road, Kempegowda Maharaja Complex, Kempegowda Extension, Chickpete, Bengaluru, Karnataka. Pin-560009 (India)",Mall / Shopping,complex
202_201,2575,12.973080058873787,77.57888757681553,BTP044 - Sagar Theatre Junction,Upparpet,"3rd Cross Road, Kempegowda Extension, Chickpete, Bengaluru, Karnataka. Pin-560009 (India)",Entertainment,theatre
202_202,742,12.9731564041779,77.57972311266847,BTP038 - Mysore Bank Junction,Upparpet,"3rd Cross Road, Kempegowda Extension, Chickpete, Bengaluru, Karnataka. Pin-560009 (India)",Commercial street,cross
202_203,399,12.972879181453635,77.58114203007518,BTP038 - Mysore Bank Junction,Upparpet,"Kempegowda Road, Mysore Bank Circle, Chickpete, Bengaluru, Karnataka. Pin-560009 (India)",Commercial street,circle
202_212,42,12.972340683333332,77.59387917857143,BTP063 - Siddalingaiah Circle,Cubbon Park,"Cubbon Park Road, Siddalingaiah Circle, Gandhi Nagar, Bengaluru, Karnataka. Pin-560001 (India)",Commercial street,circle
202_217,35,12.973017114285716,77.60049395428571,No Junction,Cubbon Park,"Nexus Venture Partners, 301, State Bank Road, Shanthala Nagar, Ashokanagar, Bengaluru Central City Corporation, Bengaluru, Bangalore North, Bengaluru Urban, Karnataka, 560001, India",Residential,nagar
202_222,175,12.972722110285714,77.60739482285715,No Junction,Ashok Nagar,"Brigade Road, ACR Towers, Shanthala Nagar, Bengaluru, Karnataka. Pin-560001 (India)",Residential,nagar
202_223,59,12.973230666101696,77.60925959661017,No Junction,Ashok Nagar,"Residency Road, ACR Towers, Shanthala Nagar, Bengaluru, Karnataka. Pin-560001 (India)",Residential,nagar
202_224,46,12.973239826086957,77.61080327391305,No Junction,Ashok Nagar,"Commissariat Road, Bangalore Central, Ashok Nagar, Bengaluru, Karnataka. Pin-560025 (India)",Residential,nagar
202_227,197,12.973237079695433,77.6148438781726,No Junction,Halasur,"Brunton Road, Mittal Towers, Yellappa Chetty Layout, Sivanchetti Gardens, Bengaluru, Karnataka. Pin-560042 (India)",Residential,layout
202_228,291,12.973257471134021,77.61577334707903,No Junction,Halasur,"Mahatma Gandhi Road, Mittal Towers, Yellappa Chetty Layout, Sivanchetti Gardens, Bengaluru, Karnataka. Pin-560042 (India)",Residential,layout
202_229,176,12.972944388068184,77.61712788863636,No Junction,Halasur,"Mahatma Gandhi Road, Craig Park Layout, Ashok Nagar, Bengaluru, Karnataka. Pin-560001 (India)",Residential,layout
202_230,81,12.972462295061728,77.61849448888889,No Junction,Halasur,"Mahatma Gandhi Road, Trinity Circle, Ashok Nagar, Bengaluru, Karnataka. Pin-560001 (India)",Commercial street,circle
202_231,185,12.972904964575118,77.62008657838773,No Junction,Halasur,"Murphy Road, 1 MG Road Mall, Someshwarpura, Halasuru, Bengaluru, Karnataka. Pin-560008 (India)",Mall / Shopping,mall
202_232,85,12.97307878117647,77.62148785294117,No Junction,Halasur,"Old Madras Road, Lido Mall, Someshwarpura, Halasuru, Bengaluru, Karnataka. Pin-560008 (India)",Mall / Shopping,mall
202_233,93,12.973383866666667,77.62250441290323,No Junction,Halasur,"Old Madras Road, Lido Mall, Someshwarpura, Halasuru, Bengaluru, Karnataka. Pin-560008 (India)",Mall / Shopping,mall
202_235,44,12.972518488636364,77.6259967659091,No Junction,Halasur,"1st Cross Road, Ranka Court, Halasuru, Bengaluru, Karnataka. Pin-560008 (India)",Commercial street,cross
202_236,48,12.972770083333332,77.626585375,No Junction,Halasur,"1st Cross Road, Udani Layout, Halasuru, Bengaluru, Karnataka. Pin-560008 (India)",Commercial street,cross
202_258,42,12.972673802415628,77.65764255491787,No Junction,Jeevanbheemanagar,"1st Main Road, BDA Apartments, HAL Stage 3, New Thippasandra, Bengaluru, Karnataka. Pin-560075 (India)",Commercial street,main road
202_297,73,12.972565604109588,77.71128526712329,No Junction,Mahadevapura,"2nd Main Road, Prestige Technostar, Industrial Area Phase 1, Doddanekundi, Bengaluru, Karnataka. Pin-560048 (India)",Commercial street,main road
203_151,58,12.974107381034482,77.50913078103449,No Junction,Jnanabharathi,"Kengeri Main Road, RHBCS Layout, Nagarbhavi Stage 2, Bengaluru, Karnataka. Pin-560072 (India)",Commercial street,main road
203_176,529,12.973941236672967,77.54460265066163,BTP020 - Hosahalli Metro Station,Vijayanagara,"1st B Main Road, Manuvana, Vijaya Nagar, Bengaluru, Karnataka. Pin-560040 (India)",Metro / Transit hub,metro
203_177,2926,12.974399145933015,77.54527605167463,BTP020 - Hosahalli Metro Station,Vijayanagara,"Chord Road, Manuvana, Vijaya Nagar, Bengaluru, Karnataka. Pin-560040 (India)",Metro / Transit hub,metro
203_178,727,12.97442438688915,77.54678151579536,BTP069 - MC Circle,Vijayanagara,"Chord Road, Sindhya Sunshine Apartment, Vijaya Nagar, Bengaluru, Karnataka. Pin-560040 (India)",Commercial street,circle
203_179,388,12.974385934127548,77.54786439253196,BTP069 - MC Circle,Vijayanagara,"Chord Road, Sindhya Sunshine Apartment, Vijaya Nagar, Bengaluru, Karnataka. Pin-560040 (India)",Commercial street,circle
203_180,113,12.97385550795794,77.54957474671681,"BTP070 - Cholurpalya Junction, Magadi Road",Magadi Road,"1st Cross Road, Vidyaranya Nagar, Cholurpalya, Bengaluru, Karnataka. Pin-560023 (India)",Education,vidya
203_181,1072,12.973731326492537,77.55121899906717,"BTP070 - Cholurpalya Junction, Magadi Road",Magadi Road,"G Narayana Kumar Road, Mallige Thotta, Cholurpalya, Bengaluru, Karnataka. Pin-560023 (India)",Mall / Shopping,mall
203_182,96,12.97421545,77.55180858645834,BTP071 - Prasanna Junction,Magadi Road,"G Narayana Kumar Road, Mehta Ambience, Manjunatha Nagar, Cholurpalya, Bengaluru, Karnataka. Pin-560023 (India)",Residential,nagar
203_192,48,12.97419048125,77.56624856250001,BTP074 - Leprosy Hospital Junction,Magadi Road,"Binny Mill Main Road, Railway Quarters, Subhash Nagar, Sevashrama, Bengaluru, Karnataka. Pin-560023 (India)",Metro / Transit hub,railway
203_195,35,12.974692722857142,77.57046312285715,BTP048 - Shanthala Junction,Chamarajpet,"Dr TCM Royan Road, Cottonpet Circle, Cottonpete, Bengaluru, Karnataka. Pin-560053 (India)",Commercial street,circle
203_198,259,12.974390307335907,77.57457134980694,BTP043 - Upparpet Junction,Upparpet,"Dharmambudi Kere Road, Upparpet Junction, Gandhi Nagar, Bengaluru, Karnataka. Pin-560009 (India)",Residential,nagar
203_199,78,12.974362180769232,77.57546336282051,BTP043 - Upparpet Junction,Upparpet,"Dharmambudi Kere Road, Balepet Circle, Chickpete, Bengaluru, Karnataka. Pin-560053 (India)",Commercial street,circle
203_200,186,12.974506465053764,77.57745419731182,BTP044 - Sagar Theatre Junction,Upparpet,"Kempegowda Road, Sagar Theatre Junction, Gandhi Nagar, Bengaluru, Karnataka. Pin-560009 (India)",Entertainment,theatre
203_201,1411,12.973939468391213,77.57854878766832,BTP044 - Sagar Theatre Junction,Upparpet,"1st Cross Road, Kempegowda Maharaja Complex, Kempegowda Extension, Chickpete, Bengaluru, Karnataka. Pin-560009 (India)",Mall / Shopping,complex
203_202,459,12.973611934640523,77.57941368278867,BTP044 - Sagar Theatre Junction,Upparpet,"3rd Cross Road, Kempegowda Extension, Chickpete, Bengaluru, Karnataka. Pin-560009 (India)",Entertainment,theatre
203_203,92,12.973937901086957,77.58162338369566,BTP038 - Mysore Bank Junction,Upparpet,"Palace Road, Mysore Bank Circle, Chickpete, Bengaluru, Karnataka. Pin-560009 (India)",Entertainment,palace
203_204,94,12.973838310638298,77.58283657659575,BTP038 - Mysore Bank Junction,Halasuru Gate,"Dr Ambedkar Road, Cauvery Bhavan, Ambedkar Veedhi, Gandhi Nagar, Bengaluru, Karnataka. Pin-560009 (India)",Residential,nagar
203_219,31,12.974486783870969,77.60338390645161,No Junction,Cubbon Park,"Museum Road, Empire Juice Junction, Shanthala Nagar, Bengaluru, Karnataka. Pin-560001 (India)",Residential,nagar
203_221,40,12.974475864999999,77.60635237,No Junction,Cubbon Park,"Church Street, Cauvery Junction, Shanthala Nagar, Bengaluru, Karnataka. Pin-560001 (India)",Religious,church
203_222,272,12.974405116698703,77.60766465389031,No Junction,Ashok Nagar,"Brigade Road, Cauvery Junction, Shanthala Nagar, Bengaluru, Karnataka. Pin-560001 (India)",Residential,nagar
203_223,127,12.974037262992127,77.60928555039371,No Junction,Ashok Nagar,"Residency Road, ACR Towers, Shanthala Nagar, Bengaluru, Karnataka. Pin-560001 (India)",Residential,nagar
203_224,33,12.97428649090909,77.61078882727273,No Junction,Ashok Nagar,"Mahatma Gandhi Road, Mayo Hall Junction, Sivanchetti Gardens, Bengaluru, Karnataka. Pin-560042 (India)",Mixed / Other,
203_226,57,12.973689521052632,77.61335364385964,No Junction,Halasur,"Mahatma Gandhi Road, WEBBS Circle Junction, Ashok Nagar, Bengaluru, Karnataka. Pin-560001 (India)",Commercial street,circle
203_227,410,12.973802704878048,77.61450682512195,No Junction,Halasur,"Mahatma Gandhi Road, WEBBS Circle Junction, Ashok Nagar, Bengaluru, Karnataka. Pin-560001 (India)",Commercial street,circle
203_228,40,12.973640945,77.6156348825,No Junction,Halasur,"Mahatma Gandhi Road, Mittal Towers, Yellappa Chetty Layout, Sivanchetti Gardens, Bengaluru, Karnataka. Pin-560042 (India)",Residential,layout
203_231,132,12.974321408333335,77.62017236287879,No Junction,Halasur,"Shivashankara Road, Begum Mahal Junction, Halasuru, Bengaluru, Karnataka. Pin-560008 (India)",Mixed / Other,
203_233,245,12.973839233061224,77.62317769102042,No Junction,Halasur,"Old Madras Road, Someshwarpura, Halasuru, Bengaluru, Karnataka. Pin-560008 (India)",Mixed / Other,
203_234,111,12.974144666666666,77.6238093045045,No Junction,Halasur,"Old Madras Road, Ramayya Circle, Halasuru, Bengaluru, Karnataka. Pin-560008 (India)",Commercial street,circle
203_235,45,12.974513374908732,77.6255305117219,No Junction,Halasur,"Cambridge Road, Ramayya Circle, Halasuru, Bengaluru, Karnataka. Pin-560008 (India)",Commercial street,circle
203_297,83,12.97433754939759,77.71094455903615,No Junction,Mahadevapura,"ITPL Main Road, Sattva Knowledge Court, Kundalhalli, Bengaluru, Karnataka. Pin-560048 (India)",Commercial street,main road
204_167,48,12.976037872916665,77.53154360208333,BTP214 - 5th Main Chamrajpet  Junction,Vijayanagara,"VKRV Rao Road, Prasanthnagar Circle, Vijaya Nagar North, Bengaluru, Karnataka. Pin-560079 (India)",Commercial street,circle
204_177,82,12.97544037804878,77.5450832390244,BTP020 - Hosahalli Metro Station,Vijayanagara,"1st Cross Road, Sindhya Sunshine Apartment, Vijaya Nagar, Bengaluru, Karnataka. Pin-560040 (India)",Metro / Transit hub,metro
204_179,65,12.975276712307691,77.54813449076923,BTP069 - MC Circle,Vijayanagara,"G Narayana Kumar Road, Shri Balagangadharanath Swamiji Circle, Vijaya Nagar, Bengaluru, Karnataka. Pin-560040 (India)",Commercial street,circle
204_182,67,12.975315041791045,77.55233185671642,BTP071 - Prasanna Junction,Magadi Road,"80 Feet Ring Road, Prasanna Theatre Circle, Rajaji Nagar, Bengaluru, Karnataka. Pin-560010 (India)",Entertainment,theatre
204_183,31,12.975521850049507,77.5539689684297,BTP071 - Prasanna Junction,Magadi Road,"G Narayana Kumar Road, Purva Blubelle, KP Agrahara, Bengaluru, Karnataka. Pin-560023 (India)",Mixed / Other,
204_185,42,12.975656493025943,77.55651988219965,BTP071 - Prasanna Junction,Magadi Road,"G Narayana Kumar Road, Purva Sunflower, Shankarappa Garden, Magadi Road Area, Bengaluru, Karnataka. Pin-560023 (India)",Mixed / Other,
204_186,116,12.97570205596226,77.55798748646984,No Junction,Magadi Road,"G Narayana Kumar Road, Block C, KP Agrahara, Bengaluru, Karnataka. Pin-560023 (India)",Residential,block
204_187,765,12.975741040669352,77.55898727110986,No Junction,Magadi Road,"G Narayana Kumar Road, Block C, KP Agrahara, Bengaluru, Karnataka. Pin-560023 (India)",Residential,block
204_188,497,12.975728169818913,77.5606274830986,BTP074 - Leprosy Hospital Junction,Magadi Road,"G Narayana Kumar Road, Annapurneshwari Industrial Area, Magadi Road Area, Bengaluru, Karnataka. Pin-560023 (India)",Hospital,hospital
204_189,289,12.975643509017248,77.56161547239748,BTP074 - Leprosy Hospital Junction,Magadi Road,"G Narayana Kumar Road, Annapurneshwari Industrial Area, Magadi Road Area, Bengaluru, Karnataka. Pin-560023 (India)",Hospital,hospital
204_195,166,12.9754599287356,77.57075813422358,BTP048 - Shanthala Junction,Chamarajpet,"Rao Bahadur DGT Road, Cottonpet Circle, Cottonpete, Bengaluru, Karnataka. Pin-560053 (India)",Commercial street,circle
204_196,41,12.975653546341464,77.57113203658537,BTP048 - Shanthala Junction,Chamarajpet,"Rao Bahadur DGT Road, Cottonpet Circle, Cottonpete, Bengaluru, Karnataka. Pin-560053 (India)",Commercial street,circle
204_198,858,12.975495482517482,77.57478270675992,BTP045 - Danvanthri Road Junction,Upparpet,"Major T Ramachandrappa Road, Elite Junction, Gandhi Nagar, Bengaluru, Karnataka. Pin-560009 (India)",Commercial street,road junction
204_199,2383,12.975576602517835,77.57612092299622,BTP040 - Elite Junction,Upparpet,"Kempegowda Road, Kempe Gowda Circle, Gandhi Nagar, Bengaluru, Karnataka. Pin-560009 (India)",Commercial street,circle
204_200,1520,12.97591640855263,77.57730120072368,BTP040 - Elite Junction,Upparpet,"5th Main Road, Kempe Gowda Circle, Gandhi Nagar, Bengaluru, Karnataka. Pin-560009 (India)",Commercial street,main road
204_201,1205,12.975811967883818,77.57846760614107,BTP044 - Sagar Theatre Junction,Upparpet,"3rd Main Road, Sri Kanakadasa Circle, Gandhi Nagar, Bengaluru, Karnataka. Pin-560009 (India)",Entertainment,theatre
204_202,146,12.976078891780823,77.57967081164384,BTP044 - Sagar Theatre Junction,Upparpet,"1st Main Road, Maharani College Junction, Gandhi Nagar, Bengaluru, Karnataka. Pin-560009 (India)",Education,college
204_203,398,12.97570243517588,77.58145270326632,BTP038 - Mysore Bank Junction,Upparpet,"Y Ramachandra Road, Maharani College Junction, Gandhi Nagar, Bengaluru, Karnataka. Pin-560009 (India)",Education,college
204_204,243,12.975552749382716,77.5826021946502,BTP038 - Mysore Bank Junction,Upparpet,"Palace Road, Maharani College Junction, Gandhi Nagar, Bengaluru, Karnataka. Pin-560009 (India)",Education,college
204_216,55,12.976030047272728,77.59948599454545,No Junction,Cubbon Park,"Sri ML Subbaraju Road, Mahatma Gandhi Circle, Shivaji Nagar, Bengaluru, Karnataka. Pin-560001 (India)",Commercial street,circle
204_219,62,12.975137059677419,77.60394217741936,No Junction,Cubbon Park,"Rest House Crescent Road, KP New Extension, Shanthala Nagar, Bengaluru, Karnataka. Pin-560001 (India)",Residential,nagar
204_222,92,12.975045727173912,77.60779555326087,BTP051 - Safina Plaza Junction,Cubbon Park,"Mahatma Gandhi Road, Cauvery Junction, Shanthala Nagar, Bengaluru, Karnataka. Pin-560001 (India)",Mall / Shopping,plaza
